{"provenance":{"side":"reference","route":"cyjs-computed","tool":"Cytoscape.js in Playwright Chromium","version":"3.34.3","command":"json-library.mjs cyjs","sourceSha256":"8b8cd3d86514c1b374b81f4a8984fe6dcde74e4a453d21f44b1df4c7a72b7313","generatedAt":"2026-11-01T18:58:39.251Z"},"canCarry":{"position":"yes","size":"yes","shape":"yes","fill":"yes","fillOpacity":"yes","borderColor":"yes","borderWidth":"yes","borderStyle":"yes","labelText":"yes","labelColor":"yes","fontSize":"yes","labelPosition":"yes","visible":"yes","zOrder":"yes","edgeColor":"yes","edgeOpacity":"yes","edgeWidth":"yes","lineStyle":"yes","arrows":"yes","edgePath":"yes","selfLoops":"yes","edgeLabel":"yes","groups":"yes","annotations":"yes","background":"yes"},"nodes":[{"id":"72-outer","x":2286.536,"y":1798.077,"w":3738.928,"h":2981.845,"shape":"roundrect","fill":"#999999","fillOpacity":1,"border":{"color":"#000000","width":4,"style":"solid"},"label":{"text":"cytosol","fontSize":16,"color":"#000000","position":"other","visible":true},"visible":true,"z":0},{"id":"72-inner","x":2324.07,"y":1824.986,"w":3635.859,"h":2898.028,"shape":"roundrect","fill":"#999999","fillOpacity":1,"border":{"color":"#000000","width":4,"style":"solid"},"label":null,"visible":true,"z":1},{"id":"76-outer","x":2338,"y":1938,"w":3040,"h":2044,"shape":"roundrect","fill":"#999999","fillOpacity":1,"border":{"color":"#000000","width":4,"style":"solid"},"label":{"text":"lysosomal lumen","fontSize":16,"color":"#000000","position":"other","visible":true},"visible":true,"z":2},{"id":"76-inner","x":2336,"y":1937,"w":2996,"h":2002,"shape":"roundrect","fill":"#999999","fillOpacity":1,"border":{"color":"#000000","width":4,"style":"solid"},"label":null,"visible":true,"z":3},{"id":"64","x":1400,"y":3056,"w":24,"h":24,"shape":"ellipse","fill":"#999999","fillOpacity":1,"border":{"color":"#000000","width":4,"style":"solid"},"label":null,"visible":true,"z":4},{"id":"65","x":1230,"y":838,"w":24,"h":24,"shape":"ellipse","fill":"#999999","fillOpacity":1,"border":{"color":"#000000","width":4,"style":"solid"},"label":null,"visible":true,"z":5},{"id":"34","x":1172,"y":2592,"w":24,"h":24,"shape":"ellipse","fill":"#999999","fillOpacity":1,"border":{"color":"#000000","width":4,"style":"solid"},"label":null,"visible":true,"z":6},{"id":"35","x":938,"y":1150,"w":24,"h":24,"shape":"ellipse","fill":"#999999","fillOpacity":1,"border":{"color":"#000000","width":12,"style":"other"},"label":null,"visible":true,"z":7},{"id":"36","x":1562,"y":830,"w":24,"h":24,"shape":"ellipse","fill":"#999999","fillOpacity":1,"border":{"color":"#000000","width":12,"style":"other"},"label":null,"visible":true,"z":8},{"id":"38","x":984,"y":3028,"w":24,"h":24,"shape":"roundrect","fill":"#999999","fillOpacity":1,"border":{"color":"#000000","width":4,"style":"solid"},"label":null,"visible":true,"z":9},{"id":"71","x":1654,"y":2842,"w":24,"h":24,"shape":"ellipse","fill":"#999999","fillOpacity":1,"border":{"color":"#000000","width":4,"style":"solid"},"label":null,"visible":true,"z":10},{"id":"39","x":3032,"y":1044,"w":24,"h":24,"shape":"ellipse","fill":"#999999","fillOpacity":1,"border":{"color":"#000000","width":4,"style":"solid"},"label":null,"visible":true,"z":11},{"id":"41","x":3564,"y":1104,"w":24,"h":24,"shape":"ellipse","fill":"#999999","fillOpacity":1,"border":{"color":"#000000","width":12,"style":"other"},"label":null,"visible":true,"z":12},{"id":"44","x":666,"y":1746,"w":24,"h":24,"shape":"roundrect","fill":"#999999","fillOpacity":1,"border":{"color":"#000000","width":4,"style":"solid"},"label":null,"visible":true,"z":13},{"id":"46","x":2294,"y":1014,"w":24,"h":24,"shape":"roundrect","fill":"#999999","fillOpacity":1,"border":{"color":"#000000","width":4,"style":"solid"},"label":null,"visible":true,"z":14},{"id":"47","x":932,"y":1652,"w":24,"h":24,"shape":"roundrect","fill":"#999999","fillOpacity":1,"border":{"color":"#000000","width":4,"style":"solid"},"label":null,"visible":true,"z":15},{"id":"50","x":2012,"y":1024,"w":24,"h":24,"shape":"ellipse","fill":"#999999","fillOpacity":1,"border":{"color":"#000000","width":4,"style":"solid"},"label":null,"visible":true,"z":16},{"id":"53","x":3386,"y":1058,"w":24,"h":24,"shape":"roundrect","fill":"#999999","fillOpacity":1,"border":{"color":"#000000","width":4,"style":"solid"},"label":null,"visible":true,"z":17},{"id":"55","x":998,"y":2446,"w":24,"h":24,"shape":"ellipse","fill":"#999999","fillOpacity":1,"border":{"color":"#000000","width":12,"style":"other"},"label":null,"visible":true,"z":18},{"id":"56","x":1710,"y":2862,"w":24,"h":24,"shape":"ellipse","fill":"#999999","fillOpacity":1,"border":{"color":"#000000","width":12,"style":"other"},"label":null,"visible":true,"z":19},{"id":"25","x":666,"y":1388,"w":24,"h":24,"shape":"ellipse","fill":"#999999","fillOpacity":1,"border":{"color":"#000000","width":12,"style":"other"},"label":null,"visible":true,"z":20},{"id":"30","x":2684,"y":1030,"w":24,"h":24,"shape":"ellipse","fill":"#999999","fillOpacity":1,"border":{"color":"#000000","width":4,"style":"solid"},"label":null,"visible":true,"z":21},{"id":"31","x":1055.076,"y":630.101,"w":24,"h":24,"shape":"ellipse","fill":"#999999","fillOpacity":1,"border":{"color":"#000000","width":4,"style":"solid"},"label":null,"visible":true,"z":22},{"id":"66","x":1078,"y":922,"w":232,"h":72,"shape":"roundrect","fill":"#999999","fillOpacity":1,"border":{"color":null,"width":0,"style":"solid"},"label":{"text":"LAMP2","fontSize":12,"color":"#000000","position":"inside","visible":true},"visible":true,"z":23},{"id":"67","x":1846,"y":1110,"w":224,"h":100,"shape":"roundrect","fill":"#999999","fillOpacity":0,"border":{"color":null,"width":0,"style":"solid"},"label":{"text":"HSP90AA1,​ HSP90AB1","fontSize":12,"color":"#000000","position":"inside","visible":true},"visible":true,"z":24},{"id":"68","x":2484,"y":928,"w":252,"h":100,"shape":"roundrect","fill":"#999999","fillOpacity":0,"border":{"color":null,"width":0,"style":"solid"},"label":{"text":"LAMP2a multimer complex","fontSize":12,"color":"#000000","position":"inside","visible":true},"visible":true,"z":25},{"id":"69","x":3800,"y":1234,"w":228,"h":128,"shape":"other","fill":"#999999","fillOpacity":0,"border":{"color":null,"width":0,"style":"solid"},"label":{"text":"LAMP2a multimer complex:​GFAP","fontSize":12,"color":"#000000","position":"inside","visible":true},"visible":true,"z":26},{"id":"70","x":836,"y":2596,"w":228,"h":128,"shape":"other","fill":"#999999","fillOpacity":0,"border":{"color":null,"width":0,"style":"solid"},"label":{"text":"p-​GFAP:​GFAP:​LAMP2a multimer","fontSize":12,"color":"#000000","position":"inside","visible":true},"visible":true,"z":27},{"id":"26","x":1506,"y":916,"w":246,"h":100,"shape":"other","fill":"#999999","fillOpacity":0,"border":{"color":null,"width":0,"style":"solid"},"label":{"text":"HSPA8:​Substrate:​LAMP2a","fontSize":12,"color":"#000000","position":"inside","visible":true},"visible":true,"z":28},{"id":"27","x":2150,"y":2952,"w":244,"h":72,"shape":"roundrect","fill":"#999999","fillOpacity":1,"border":{"color":null,"width":0,"style":"solid"},"label":{"text":"p-​GFAP","fontSize":12,"color":"#000000","position":"inside","visible":true},"visible":true,"z":29},{"id":"27-9613532","x":2060,"y":2916,"w":24,"h":24,"shape":"roundrect","fill":"#999999","fillOpacity":1,"border":{"color":null,"width":0,"style":"solid"},"label":{"text":"P","fontSize":12,"color":"#000000","position":"inside","visible":true},"visible":true,"z":30},{"id":"28","x":1164,"y":2952,"w":170,"h":100,"shape":"other","fill":"#999999","fillOpacity":0,"border":{"color":null,"width":0,"style":"solid"},"label":{"text":"EEF1A1:​GTP","fontSize":12,"color":"#000000","position":"inside","visible":true},"visible":true,"z":31},{"id":"29","x":852,"y":1520,"w":234,"h":72,"shape":"other","fill":"#999999","fillOpacity":0,"border":{"color":null,"width":0,"style":"solid"},"label":{"text":"HSPA8:​LAMP2a multimers","fontSize":12,"color":"#000000","position":"inside","visible":true},"visible":true,"z":32},{"id":"32","x":2892,"y":1114,"w":230,"h":72,"shape":"roundrect","fill":"#999999","fillOpacity":1,"border":{"color":null,"width":0,"style":"solid"},"label":{"text":"HSPA8","fontSize":12,"color":"#000000","position":"inside","visible":true},"visible":true,"z":33},{"id":"33","x":1508,"y":2950,"w":212,"h":100,"shape":"other","fill":"#999999","fillOpacity":0,"border":{"color":null,"width":0,"style":"solid"},"label":{"text":"p-​GFAP:​EEF1A1","fontSize":12,"color":"#000000","position":"inside","visible":true},"visible":true,"z":34},{"id":"37","x":840,"y":2070,"w":252,"h":100,"shape":"roundrect","fill":"#999999","fillOpacity":0,"border":{"color":null,"width":0,"style":"solid"},"label":{"text":"LAMP2a multimer complex","fontSize":12,"color":"#000000","position":"inside","visible":true},"visible":true,"z":35},{"id":"40","x":1066,"y":742,"w":240,"h":100,"shape":"other","fill":"#999999","fillOpacity":0,"border":{"color":null,"width":0,"style":"solid"},"label":{"text":"HSPA8 bound autophagic substrates","fontSize":12,"color":"#000000","position":"inside","visible":true},"visible":true,"z":36},{"id":"42","x":822,"y":2268,"w":184,"h":100,"shape":"other","fill":"#999999","fillOpacity":0,"border":{"color":null,"width":0,"style":"solid"},"label":{"text":"p-​GFAP:​GFAP","fontSize":12,"color":"#000000","position":"inside","visible":true},"visible":true,"z":37},{"id":"43","x":3564,"y":936,"w":252,"h":100,"shape":"other","fill":"#999999","fillOpacity":0,"border":{"color":null,"width":0,"style":"solid"},"label":{"text":"HSPA8:​LAMP2a multimeric complex","fontSize":12,"color":"#000000","position":"inside","visible":true},"visible":true,"z":38},{"id":"45","x":1838,"y":2952,"w":242,"h":72,"shape":"roundrect","fill":"#999999","fillOpacity":1,"border":{"color":null,"width":0,"style":"solid"},"label":{"text":"EEF1A1","fontSize":12,"color":"#000000","position":"inside","visible":true},"visible":true,"z":39},{"id":"48","x":2482,"y":1098,"w":214,"h":72,"shape":"roundrect","fill":"#999999","fillOpacity":1,"border":{"co